[
  {
    "measure_code": "POWER_FACTOR_CORRECTION",
    "name_bn": "পাওয়ার ফ্যাক্টর স্বয়ংক্রিয় ক্যাপাসিটর ব্যাংক (APFC) আধুনিকীকরণ",
    "name_en": "Automatic Power Factor Correction (APFC) Capacitor Bank Improvement",
    "category": "PowerFactor",
    "applicable_sectors": ["RMG", "TextileDyeing", "Food", "LightEngineering", "General"],
    "applicability_rules": { "grid_electricity": true },
    "saving_low": 0.0300,
    "saving_typical": 0.0600,
    "saving_high": 0.0900,
    "capex_low": 35000.00,
    "capex_high": 55000.00,
    "capex_unit": "BDT/kVAR",
    "lifetime_years": 8,
    "evidence_grade": "A",
    "source_code": "IFC_PACT_2018",
    "local_notes": "Eliminates monthly utility power factor penalty on DPDC/DESCO bills; very rapid payback."
  },
  {
    "measure_code": "LED_DAYLIGHT_LIGHTING",
    "name_bn": "হাই-বে এলইডি লাইটিং এবং ডে-লাইটিং প্রিজম্যাটিক স্কাইলাইট রূপান্তর",
    "name_en": "High-Bay Industrial LED Retrofit and Daylighting Prismatic Skylights",
    "category": "Lighting",
    "applicable_sectors": ["RMG", "TextileDyeing", "Food", "LightEngineering", "General"],
    "applicability_rules": { "has_production_floor": true },
    "saving_low": 0.0800,
    "saving_typical": 0.1200,
    "saving_high": 0.1600,
    "capex_low": 40000.00,
    "capex_high": 70000.00,
    "capex_unit": "BDT/fixture",
    "lifetime_years": 5,
    "evidence_grade": "A",
    "source_code": "IFC_PACT_2018",
    "local_notes": "Straightforward replacement of T8/T5 fluorescent fixtures across sewing and finishing lines."
  },
  {
    "measure_code": "VFD_MOTORS_COMPRESSORS",
    "name_bn": "কম্প্রেসর ও মোটরে ভেরিয়েবল ফ্রিকোয়েন্সি ড্রাইভ (VFD) সংযোজন",
    "name_en": "Variable Frequency Drives (VFD) on Motors and Compressors",
    "category": "Motors",
    "applicable_sectors": ["RMG", "TextileDyeing", "Food", "LightEngineering"],
    "applicability_rules": { "monthly_kwh_gt": 10000 },
    "saving_low": 0.1000,
    "saving_typical": 0.1500,
    "saving_high": 0.2200,
    "capex_low": 180000.00,
    "capex_high": 280000.00,
    "capex_unit": "BDT/kW",
    "lifetime_years": 8,
    "evidence_grade": "B",
    "source_code": "IFC_PACT_2018",
    "local_notes": "Highly effective for fluctuating motor loads in spinning, blowers, and air compressors."
  },
  {
    "measure_code": "COMPRESSED_AIR_LEAK_REPAIR",
    "name_bn": "কম্প্রেসড এয়ার আল্ট্রাসনিক লিক মেরামত ও প্রেশার অপ্টিমাইজেশন",
    "name_en": "Compressed Air Ultrasonic Leak Sealing & Pressure Optimization",
    "category": "CompressedAir",
    "applicable_sectors": ["RMG", "TextileDyeing", "LightEngineering"],
    "applicability_rules": { "monthly_kwh_gt": 5000 },
    "saving_low": 0.0500,
    "saving_typical": 0.1000,
    "saving_high": 0.1500,
    "capex_low": 10000.00,
    "capex_high": 25000.00,
    "capex_unit": "BDT/system",
    "lifetime_years": 3,
    "evidence_grade": "A",
    "source_code": "IFC_PACT_2018",
    "local_notes": "Ultrasonic leak detection reduces distribution line losses from 20% down to under 5%."
  },
  {
    "measure_code": "STEAM_TRAP_INSULATION_CONDENSATE",
    "name_bn": "বয়লার স্টিম ট্র্যাপ মেরামত, পাইপ ইনসুলেশন এবং কনডেনসেট রিকভারি",
    "name_en": "Boiler Steam Trap Repair, Pipe Insulation and Condensate Recovery",
    "category": "Boilers",
    "applicable_sectors": ["RMG", "TextileDyeing", "Food"],
    "applicability_rules": { "has_boiler": true },
    "saving_low": 0.0600,
    "saving_typical": 0.1000,
    "saving_high": 0.1500,
    "capex_low": 80000.00,
    "capex_high": 160000.00,
    "capex_unit": "BDT/meter",
    "lifetime_years": 6,
    "evidence_grade": "A",
    "source_code": "IFC_PACT_2018",
    "local_notes": "Critical for natural gas and diesel savings in textile washing and dyeing boilers."
  },
  {
    "measure_code": "ROOFTOP_SOLAR_PV",
    "name_bn": "নেট-মিটারিংযুক্ত রুফটপ সোলার পিভি সিস্টেম (১০০ kWp)",
    "name_en": "Grid-Tied Rooftop Solar PV with Net Metering (100 kWp)",
    "category": "SolarPV",
    "applicable_sectors": ["RMG", "TextileDyeing", "Food", "LightEngineering", "General"],
    "applicability_rules": { "roof_area_sqft_gt": 5000, "building_ownership": "Owned" },
    "saving_low": 0.1500,
    "saving_typical": 0.2200,
    "saving_high": 0.3000,
    "capex_low": 1200000.00,
    "capex_high": 2200000.00,
    "capex_unit": "BDT/system",
    "lifetime_years": 20,
    "evidence_grade": "B",
    "source_code": "SREDA_SOLAR_GUIDELINES_2022",
    "local_notes": "Under SREDA net-metering guidelines; requires factory owned roof."
  },
  {
    "measure_code": "GENSET_RIGHTSIZING_SCHEDULING",
    "name_bn": "জেনারেটর সাইজিং অপ্টিমাইজেশন এবং গ্রিড-ফার্স্ট শিডিউলিং",
    "name_en": "Generator Right-Sizing and Grid-First Priority Scheduling",
    "category": "Generators",
    "applicable_sectors": ["RMG", "TextileDyeing", "Food", "LightEngineering"],
    "applicability_rules": { "has_genset": true },
    "saving_low": 0.0800,
    "saving_typical": 0.1400,
    "saving_high": 0.2000,
    "capex_low": 50000.00,
    "capex_high": 120000.00,
    "capex_unit": "BDT/controller",
    "lifetime_years": 7,
    "evidence_grade": "B",
    "source_code": "IFC_PACT_2018",
    "local_notes": "Prevents running high-capacity diesel generators during low load periods."
  },
  {
    "measure_code": "SERVO_MOTORS_SEWING",
    "name_bn": "সেলাই মেশিনে ডিরেক্ট-ড্রাইভ সার্ভো মোটর প্রতিস্থাপন",
    "name_en": "Direct-Drive Servo Motors on Industrial Sewing Machines",
    "category": "Motors",
    "applicable_sectors": ["RMG"],
    "applicability_rules": { "sector": "RMG" },
    "saving_low": 0.1200,
    "saving_typical": 0.1800,
    "saving_high": 0.2500,
    "capex_low": 90000.00,
    "capex_high": 180000.00,
    "capex_unit": "BDT/line",
    "lifetime_years": 6,
    "evidence_grade": "A",
    "source_code": "IFC_PACT_2018",
    "local_notes": "Replaces legacy clutch motors; eliminates continuous idle electricity waste."
  },
  {
    "measure_code": "WASTE_HEAT_RECOVERY",
    "name_bn": "বয়লার ও জেনারেটর একজস্ট ফ্লু থেকে বর্জ্য তাপ পুনরুদ্ধার (ইকোনোমাইজার)",
    "name_en": "Waste Heat Recovery Economizer on Boiler & Genset Flue",
    "category": "Boilers",
    "applicable_sectors": ["TextileDyeing", "RMG", "Food"],
    "applicability_rules": { "has_boiler": true },
    "saving_low": 0.0500,
    "saving_typical": 0.0900,
    "saving_high": 0.1400,
    "capex_low": 150000.00,
    "capex_high": 300000.00,
    "capex_unit": "BDT/unit",
    "lifetime_years": 10,
    "evidence_grade": "A",
    "source_code": "IFC_PACT_2018",
    "local_notes": "Preheats boiler feedwater using 160°C exhaust flue gas, saving natural gas or diesel."
  },
  {
    "measure_code": "FREIGHT_CONSOLIDATION_MODES",
    "name_bn": "পণ্য পরিবহন সমন্বয়, রুট অপ্টিমাইজেশন এবং টায়ার প্রেশার নিয়ন্ত্রণ",
    "name_en": "Freight Route Consolidation and Transport Preventive Maintenance",
    "category": "Transport",
    "applicable_sectors": ["RMG", "TextileDyeing", "Food", "LightEngineering", "General"],
    "applicability_rules": { "has_genset": false },
    "saving_low": 0.0400,
    "saving_typical": 0.0800,
    "saving_high": 0.1200,
    "capex_low": 15000.00,
    "capex_high": 40000.00,
    "capex_unit": "BDT/fleet",
    "lifetime_years": 3,
    "evidence_grade": "B",
    "source_code": "CASCALE_HIGG_FEM_2023",
    "local_notes": "Eliminates empty return truck trips and improves fleet fuel efficiency."
  }
]
