[
  {
    "measure_code": "POWER_FACTOR_CORRECTION",
    "name_bn": "পাওয়ার ফ্যাক্টর ক্যাপাসিটর ব্যাংক আধুনিকীকরণ",
    "name_en": "Power Factor Capacitor Bank Improvement",
    "category": "PowerFactor",
    "applicable_sectors": ["RMG", "TextileDyeing", "Food", "LightEngineering", "General"],
    "applicability_rules": { "grid_electricity": true },
    "saving_low": null,
    "saving_typical": null,
    "saving_high": null,
    "capex_low": null,
    "capex_high": null,
    "capex_unit": "BDT/kVAR",
    "lifetime_years": null,
    "evidence_grade": null,
    "source_code": "IFC_PACT_2018",
    "local_notes": "Eliminates utility penalty on monthly DPDC/DESCO bills; low capex."
  },
  {
    "measure_code": "LED_DAYLIGHT_LIGHTING",
    "name_bn": "এলইডি এবং ডে-লাইটিং প্রিজম্যাটিক স্কাইলাইট স্থাপন",
    "name_en": "LED Retrofit and Daylighting Prismatic Skylights",
    "category": "Lighting",
    "applicable_sectors": ["RMG", "TextileDyeing", "Food", "LightEngineering", "General"],
    "applicability_rules": { "has_production_floor": true },
    "saving_low": null,
    "saving_typical": null,
    "saving_high": null,
    "capex_low": null,
    "capex_high": null,
    "capex_unit": "BDT/fixture",
    "lifetime_years": null,
    "evidence_grade": null,
    "source_code": "IFC_PACT_2018",
    "local_notes": "Straightforward replacement; high adoption across garment sewing lines."
  },
  {
    "measure_code": "VFD_MOTORS_COMPRESSORS",
    "name_bn": "মোটর এবং কম্প্রেসরে ভেরিয়েবল ফ্রিকোয়েন্সি ড্রাইভ (VFD) সংযোজন",
    "name_en": "Variable Frequency Drives (VFD) on Motors and Compressors",
    "category": "Motors",
    "applicable_sectors": ["RMG", "TextileDyeing", "Food", "LightEngineering"],
    "applicability_rules": { "monthly_kwh_gt": 15000 },
    "saving_low": null,
    "saving_typical": null,
    "saving_high": null,
    "capex_low": null,
    "capex_high": null,
    "capex_unit": "BDT/kW",
    "lifetime_years": null,
    "evidence_grade": null,
    "source_code": "IFC_PACT_2018",
    "local_notes": "Applicable where motor load fluctuates; payback under 2 years in spinning/dyeing."
  },
  {
    "measure_code": "COMPRESSED_AIR_LEAK_REPAIR",
    "name_bn": "কম্প্রেসড এয়ার লিক মেরামত এবং অপারেটিং প্রেশার হ্রাস",
    "name_en": "Compressed Air Leak Repair and Pressure Optimization",
    "category": "CompressedAir",
    "applicable_sectors": ["RMG", "TextileDyeing", "LightEngineering"],
    "applicability_rules": { "has_compressor": true },
    "saving_low": null,
    "saving_typical": null,
    "saving_high": null,
    "capex_low": null,
    "capex_high": null,
    "capex_unit": "BDT/system",
    "lifetime_years": null,
    "evidence_grade": null,
    "source_code": "IFC_PACT_2018",
    "local_notes": "Ultrasonic leak detection; very low cost, high instant energy savings."
  },
  {
    "measure_code": "STEAM_TRAP_INSULATION_CONDENSATE",
    "name_bn": "স্টিম ট্র্যাপ মেরামত, পাইপ ইনসুলেশন এবং কনডেনসেট রিকভারি",
    "name_en": "Steam Trap Repair, Pipe Insulation and Condensate Recovery",
    "category": "Boilers",
    "applicable_sectors": ["RMG", "TextileDyeing", "Food"],
    "applicability_rules": { "has_boiler": true },
    "saving_low": null,
    "saving_typical": null,
    "saving_high": null,
    "capex_low": null,
    "capex_high": null,
    "capex_unit": "BDT/meter",
    "lifetime_years": null,
    "evidence_grade": null,
    "source_code": "IFC_PACT_2018",
    "local_notes": "Critical for gas savings in textile washing and dyeing boilers."
  },
  {
    "measure_code": "BOILER_TUNING_FUEL_SWITCH",
    "name_bn": "বয়লার এয়ার-ফুয়েল রেশিও টিউনিং এবং বার্নার আধুনিকীকরণ",
    "name_en": "Boiler Air-Fuel Ratio Tuning and Burner Optimization",
    "category": "Boilers",
    "applicable_sectors": ["RMG", "TextileDyeing", "Food"],
    "applicability_rules": { "has_boiler": true },
    "saving_low": null,
    "saving_typical": null,
    "saving_high": null,
    "capex_low": null,
    "capex_high": null,
    "capex_unit": "BDT/boiler",
    "lifetime_years": null,
    "evidence_grade": null,
    "source_code": "IFC_PACT_2018",
    "local_notes": "Requires periodic flue gas oxygen analysis."
  },
  {
    "measure_code": "ROOFTOP_SOLAR_PV",
    "name_bn": "নেট-মিটারিংযুক্ত রুফটপ সোলার পিভি স্থাপন",
    "name_en": "Grid-Tied Rooftop Solar PV with Net Metering",
    "category": "SolarPV",
    "applicable_sectors": ["RMG", "TextileDyeing", "Food", "LightEngineering", "General"],
    "applicability_rules": { "roof_area_sqft_gt": 10000, "building_ownership": "Owned" },
    "saving_low": null,
    "saving_typical": null,
    "saving_high": null,
    "capex_low": null,
    "capex_high": null,
    "capex_unit": "BDT/kWp",
    "lifetime_years": null,
    "evidence_grade": null,
    "source_code": "SREDA_SOLAR_GUIDELINES_2022",
    "local_notes": "Requires structural roof load fitness certificate and utility net-metering approval."
  },
  {
    "measure_code": "GENSET_RIGHTSIZING_SCHEDULING",
    "name_bn": "জেনারেটর সাইজিং অপ্টিমাইজেশন এবং গ্রিড-ফার্স্ট শিডিউলিং",
    "name_en": "Generator Right-Sizing and Grid-First Priority Scheduling",
    "category": "Generators",
    "applicable_sectors": ["RMG", "TextileDyeing", "Food", "LightEngineering"],
    "applicability_rules": { "has_genset": true },
    "saving_low": null,
    "saving_typical": null,
    "saving_high": null,
    "capex_low": null,
    "capex_high": null,
    "capex_unit": "BDT/controller",
    "lifetime_years": null,
    "evidence_grade": null,
    "source_code": "IFC_PACT_2018",
    "local_notes": "Prevents running large diesel generators at low partial load."
  },
  {
    "measure_code": "SERVO_MOTORS_SEWING",
    "name_bn": "সেলাই মেশিনে ডিরেক্ট-ড্রাইভ সার্ভো মোটর সংযোজন",
    "name_en": "Direct-Drive Servo Motors on Industrial Sewing Machines",
    "category": "Motors",
    "applicable_sectors": ["RMG"],
    "applicability_rules": { "sector": "RMG" },
    "saving_low": null,
    "saving_typical": null,
    "saving_high": null,
    "capex_low": null,
    "capex_high": null,
    "capex_unit": "BDT/machine",
    "lifetime_years": null,
    "evidence_grade": null,
    "source_code": "IFC_PACT_2018",
    "local_notes": "Directly replaces legacy high-idle clutch motors on sewing lines."
  },
  {
    "measure_code": "WASTE_HEAT_RECOVERY",
    "name_bn": "বয়লার এবং জেনারেটর একজস্ট থেকে বর্জ্য তাপ পুনরুদ্ধার (ইকোনোমাইজার)",
    "name_en": "Waste Heat Recovery Economizer on Exhaust Flues",
    "category": "Boilers",
    "applicable_sectors": ["TextileDyeing", "RMG", "Food"],
    "applicability_rules": { "has_boiler": true },
    "saving_low": null,
    "saving_typical": null,
    "saving_high": null,
    "capex_low": null,
    "capex_high": null,
    "capex_unit": "BDT/unit",
    "lifetime_years": null,
    "evidence_grade": null,
    "source_code": "IFC_PACT_2018",
    "local_notes": "Preheats boiler feedwater using hot exhaust gas."
  },
  {
    "measure_code": "FREIGHT_CONSOLIDATION_MODES",
    "name_bn": "পণ্য পরিবহন সমন্বয় এবং জ্বালানি-সাশ্রয়ী মোড নির্বাচন",
    "name_en": "Freight Shipment Consolidation and Route Optimization",
    "category": "Transport",
    "applicable_sectors": ["RMG", "TextileDyeing", "Food", "LightEngineering", "General"],
    "applicability_rules": { "has_shipping": true },
    "saving_low": null,
    "saving_typical": null,
    "saving_high": null,
    "capex_low": null,
    "capex_high": null,
    "capex_unit": "BDT/fleet",
    "lifetime_years": null,
    "evidence_grade": null,
    "source_code": "CASCALE_HIGG_FEM_2023",
    "local_notes": "Increases truck payload capacity utilization, avoiding empty return trips."
  },
  {
    "measure_code": "FLEET_MAINTENANCE_DRIVING",
    "name_bn": "পরিবহন বহর নিয়মিত রক্ষণাবেক্ষণ এবং টায়ার প্রেশার নিয়ন্ত্রণ",
    "name_en": "Transport Fleet Preventive Maintenance and Tire Optimization",
    "category": "Transport",
    "applicable_sectors": ["RMG", "Food", "General"],
    "applicability_rules": { "has_company_vehicles": true },
    "saving_low": null,
    "saving_typical": null,
    "saving_high": null,
    "capex_low": null,
    "capex_high": null,
    "capex_unit": "BDT/vehicle",
    "lifetime_years": null,
    "evidence_grade": null,
    "source_code": "CASCALE_HIGG_FEM_2023",
    "local_notes": "Maintains proper tire pressure and fuel filter hygiene on delivery vans."
  }
]
