[
  {
    "measure_code": "LED_DAYLIGHT_LIGHTING",
    "name_bn": "হাই-বে এলইডি লাইটিং এবং ডে-লাইটিং প্রিজম্যাটিক স্কাইলাইট",
    "name_en": "High-Bay Industrial LED Retrofit and Daylighting Prismatic Skylights",
    "category": "Lighting",
    "applicable_sectors": ["RMG", "TextileDyeing", "General"],
    "applicability_rules": { "grid_electricity": true },
    "saving_low": 0.0800,
    "saving_typical": 0.1200,
    "saving_high": 0.1800,
    "capex_low": 120000.00,
    "capex_high": 180000.00,
    "capex_unit": "BDT/floor",
    "lifetime_years": 5,
    "evidence_grade": "A",
    "source_code": "IFC_PACT_2018",
    "local_notes": "Straightforward replacement of T8/T5 fluorescent fixtures across sewing and finishing lines."
  },
  {
    "measure_code": "VFD_MOTORS_COMPRESSORS",
    "name_bn": "কম্প্রেসর ও মোটরে ভেরিয়েবল ফ্রিকোয়েন্সি ড্রাইভ (VFD) সংযোজন",
    "name_en": "Variable Frequency Drives (VFD) on Motors and Compressors",
    "category": "Motors",
    "applicable_sectors": ["RMG", "TextileDyeing"],
    "applicability_rules": { "monthly_kwh_gt": 10000 },
    "saving_low": 0.1000,
    "saving_typical": 0.1500,
    "saving_high": 0.2200,
    "capex_low": 250000.00,
    "capex_high": 350000.00,
    "capex_unit": "BDT/compressor",
    "lifetime_years": 8,
    "evidence_grade": "B",
    "source_code": "IFC_PACT_2018",
    "local_notes": "Highly effective for fluctuating motor loads in spinning, blowers, and air compressors."
  },
  {
    "measure_code": "ROOFTOP_SOLAR_PV",
    "name_bn": "নেট-মিটারিংযুক্ত রুফটপ সোলার পিভি সিস্টেম (১০০ kWp)",
    "name_en": "Grid-Tied Rooftop Solar PV with Net Metering (100 kWp)",
    "category": "SolarPV",
    "applicable_sectors": ["RMG", "TextileDyeing", "General"],
    "applicability_rules": { "roof_area_sqft_gt": 10000, "building_ownership": "Owned" },
    "saving_low": 0.1500,
    "saving_typical": 0.2000,
    "saving_high": 0.2800,
    "capex_low": 1500000.00,
    "capex_high": 2200000.00,
    "capex_unit": "BDT/system",
    "lifetime_years": 20,
    "evidence_grade": "A",
    "source_code": "SREDA_SOLAR_GUIDELINES_2022",
    "local_notes": "Generates daytime peak solar power reducing grid tariff dependency."
  }
]
